{
  "schemaVersion": "1.0.0",
  "id": "reference.mechanics-collision",
  "title": "Elastic Collision",
  "titleFa": "برخورد کشسان دو جسم",
  "domain": "mechanics",
  "simulation": {"dt": 0.001, "timeScale": 1, "gravity": {"x": 0, "y": 0}},
  "parts": [
    {"instanceId": "ball-a", "partId": "mechanics.ball", "transform": {"position": {"x": -0.49, "y": 0}}, "properties": {"mass": 1, "radius": 0.5, "velocityX": 1, "restitution": 1}},
    {"instanceId": "ball-b", "partId": "mechanics.ball", "transform": {"position": {"x": 0.49, "y": 0}}, "properties": {"mass": 1, "radius": 0.5, "velocityX": -1, "restitution": 1}}
  ],
  "connections": [],
  "probes": [{"id": "momentum", "quantity": "momentum"}],
  "metadata": {"stage": 3}
}
